"question","manual_source","page","section","answer_summary"
"How do I create and run Jog profiles in DriveWare?","AMC_SW_Manual_DriveWare.pdf","85","Motion Tasks / Jog","In DriveWare under Motion Tasks > Jog, configure up to 4 Jog Velocity presets (Jog Speed 1–4 in RPM or user units), plus shared Acceleration and Deceleration ramp rates. Jog direction (positive or negative) and speed level are selected from the Motion Panel or via digital input assignments (assign DI functions Jog +Speed1/2 and Jog -Speed1/2 to specific inputs). Pressing and holding the Jog button (or holding the digital input active) runs the motor continuously at the selected speed; releasing the input applies the programmed deceleration ramp to stop. Jog is useful for verifying direction convention and feedback polarity after initial wiring. For the full guide, download the DriveWare Software User Manual from a-m-c.com > Support > Downloads > Software Downloads."
"How do I use the digital oscilloscope in DriveWare?","AMC_SW_Manual_DriveWare.pdf","90","Tools and Functions / Digital Oscilloscope","The DriveWare digital oscilloscope (Tools > Oscilloscope) captures up to 4 simultaneous channels of drive-internal signals sampled at the servo loop rate. Add channels by clicking the + button and selecting from the signal list: Velocity Target, Velocity Measured, Current Target, Current Measured, Position Target, Position Error, and others. Configure trigger source, trigger level, and sample window duration, then click Start to arm the capture. After a trigger event, the waveform is displayed and can be zoomed and panned. Use Cursor A/B to measure time intervals and amplitudes. Save captures as .dwc files or export as .csv for analysis in Excel or MATLAB. For the full guide, download the DriveWare Software User Manual from a-m-c.com > Support > Downloads > Software Downloads."
"How do I download firmware to a DigiFlex drive using DriveWare?","AMC_SW_Manual_DriveWare.pdf","88","Downloading the Firmware","In DriveWare, go to File > Download Firmware. Use Browse Folder to point to the folder containing the firmware .bin or .fmw file, or Browse File to select a specific firmware file; firmware is named by drive series and version (e.g., DigiFlex_v5.x.x.x.fmw). Download occurs over the active communication channel — RS-232 is standard; CAN is also supported but slower. Do NOT interrupt power or the communication link during the firmware download process; an incomplete download may require factory recovery. After the firmware is downloaded, cycle power to the drive to activate the new firmware, then re-connect with DriveWare and verify the firmware version in Drive Information. For the full guide, download the DriveWare Software User Manual from a-m-c.com > Support > Downloads > Software Downloads."
"What are the EtherCAT drive control state machine states?","AMC_CommManual_FP_EtherCAT.pdf","21","Communication Manual / Control State Machine","The CiA 402 drive state machine has 8 states controlled via the Controlword (object 6040h) and monitored via the Statusword (object 6041h): Not Ready to Switch On (power-on initialization, not user-accessible), Switch On Disabled (power bridge disabled, drive idle), Ready to Switch On (fault-free, waiting for Switch On command), Switched On (bridge enabled, current loops active, waiting for Enable Operation), Operation Enabled (full servo control active, motor responds to commands), Quick Stop Active (deceleration in progress after Quick Stop command), Fault Reaction Active (fault detected, executing fault reaction), and Fault (fault state, requires Fault Reset command to clear). The standard enable sequence writes Controlword = 6 (Ready to Switch On), then 7 (Switch On), then 15 (Enable Operation). For the full guide, download the FlexPro EtherCAT Communication Manual from a-m-c.com > Support > Downloads > Communication Manuals."
"What does the Operation Enabled state mean?","AMC_CommManual_FP_EtherCAT.pdf","22","Communication Manual / Control State Machine","Operation Enabled (Statusword bits 0–5 = 0x37, i.e., bits: Ready=1, Switched On=1, Operation Enabled=1, Fault=0, Voltage Enabled=1, Quick Stop=1) is the normal run state: the power bridge is energized, all control loops (current, velocity, position) are active, and the drive executes commands received via PDO or SDO. To enter this state, the host writes Controlword = 15 (0x000F) while in Switched On state. To leave gracefully, write Controlword = 7 (disable operation), then 6 (switch off) to return to Switch On Disabled. Any fault condition automatically transitions the drive to Fault Reaction Active then Fault; write Controlword bit 7 = 1 (Fault Reset) to return to Switch On Disabled after clearing the fault condition. For the full guide, download the FlexPro EtherCAT Communication Manual from a-m-c.com > Support > Downloads > Communication Manuals."
"How do I troubleshoot a red LED on an analog drive?","AMC_AppNote_009.pdf","1","AN-009 / Troubleshooting a Red LED","Check for over-voltage, under-voltage, and invalid Hall state conditions. For brushless drives, verify the 3 Hall sensor inputs are connected properly and returning valid states. Key addresses: 3012, 5A20, 3805, 1935. For the full guide, download ""Application Note 009"" from a-m-c.com > Support > Downloads > Application Notes."
"What causes over-voltage shutdown on a servo drive?","AMC_HWManual_AnalogDrives.pdf","65","Troubleshooting / Over-Voltage Shutdown","If the DC bus voltage exceeds the drive's rated limit, an over-voltage shutdown occurs. Check the AC power line for proper voltage and verify the DC power supply output is within the drive's rated range. For the full guide, download ""AMC_HWManual_AnalogDrives.pdf"" from a-m-c.com > Support > Downloads > Hardware Manuals."
"What causes overload faults on servo drives?","AMC_HWManual_AnalogDrives.pdf","66","Troubleshooting / Fault Conditions and Symptoms","Overload occurs when continuous current exceeds the drive's rating. When using a single phase (brushed) motor with a three phase (brushless) drive, use the 60-degree phase setting. For the full guide, download ""AMC_HWManual_AnalogDrives.pdf"" from a-m-c.com > Support > Downloads > Hardware Manuals."
"What causes jerky or rough motor motion?","AMC_HWManual_AnalogDrives.pdf","68","Troubleshooting / Motor Problems","Jerky motion is typically caused by improper commutation, usually because the motor phasing or Hall sensor wiring is incorrect. Verify commutation settings and feedback connections. Key addresses: 1023, 7532, 1118, 15A8. For the full guide, download ""AMC_HWManual_AnalogDrives.pdf"" from a-m-c.com > Support > Downloads > Hardware Manuals."
"How do I troubleshoot excessive heating of the drive and motor?","AMC_HWManual_AnalogDrives.pdf","67","Troubleshooting / Fault Conditions and Symptoms","Excessive heating is characteristic of minimum inductance issues or excessive continuous current draw. Verify minimum inductance requirements are met and reduce current limits if needed. Key addresses: 1023, 7532, 1118, 15A8. For the full guide, download ""AMC_HWManual_AnalogDrives.pdf"" from a-m-c.com > Support > Downloads > Hardware Manuals."
"What fault codes are available in the CANopen object dictionary?","AMC_CommManual_CANopen.pdf","281","Object Dictionary / Drive Operation Objects","Object 2027.04h provides the Absolute Encoder Fault Word. Emergency (EMCY) messages contain error codes and additional bytes identifying the specific fault condition. Key addresses: 200E, 2027, 2027h. For the full guide, download ""AMC_CommManual_CANopen.pdf"" from a-m-c.com > Support > Downloads > Communication Manuals."
"What are the emergency error codes for CANopen drives?","AMC_CommManual_CANopen.pdf","28","Communication Manual / Emergency Messages","Error codes include PVT Sequence Counter Error and various drive fault conditions. The EMCY message contains the error code in bytes 1-2 and additional manufacturer-specific data in bytes 5-8. Key addresses: 1800, 1984, 1A00. For the full guide, download ""AMC_CommManual_CANopen.pdf"" from a-m-c.com > Support > Downloads > Communication Manuals."
"How do I read the drive fault status in EtherCAT?","AMC_CommManual_EtherCAT.pdf","209","Object Dictionary / Drive Operation Objects","Object 2027.04h contains the Absolute Encoder Fault Word. Additional fault information is available through the Status Word (6041h) and manufacturer-specific fault objects. Key addresses: 200E, 2027, 2027h. For the full guide, download ""AMC_CommManual_EtherCAT.pdf"" from a-m-c.com > Support > Downloads > Communication Manuals."
"How do I configure Safe Torque Off (STO) on a DigiFlex drive?","AMC_HWManual_DigiFlex_Panel_EtherCAT.pdf","50","Operation and Features / STO","STO requires both STO-1 and STO-2 inputs to be active for the drive to operate. The STO operation test must be performed to maintain SIL 3, Cat 4 / PL e certification. Key addresses: 1800, 3849, 1508, 2061. For the full guide, download ""AMC_HWManual_DigiFlex_Panel_EtherCAT.pdf"" from a-m-c.com > Support > Downloads > Hardware Manuals."
"How do I test the STO function on a DigiFlex panel drive?","AMC_HWManual_DigiFlex_Panel_EtherCAT.pdf","50","Operation and Features / STO Operation Test","To maintain safety certification, perform the STO operation test by removing the STO input signals and verifying the drive disables motor power within the specified response time. Key addresses: 1800, 3849, 1508, 2061. For the full guide, download ""AMC_HWManual_DigiFlex_Panel_EtherCAT.pdf"" from a-m-c.com > Support > Downloads > Hardware Manuals."
"How do I wire the STO inputs on a FlexPro PCB mount drive?","AMC_HWManual_FlexPro_PCB.pdf","25","Products and System Requirements / Terminal Pins","STO-1 INPUT is on pin T1, STO RETURN is on pin T2, and STO-2 INPUT is on pin T3. Both STO inputs must be energized for the drive to enable motor power. Key addresses: E100, E060. For the full guide, download ""AMC_HWManual_FlexPro_PCB.pdf"" from a-m-c.com > Support > Downloads > Hardware Manuals."
"What are the operating temperature ranges for FlexPro drives?","AMC_HWManual_FlexPro_PCB.pdf","30","Products and System Requirements / Specifications","Ambient operating temperature is 0-65C (32-149F), storage temperature is -40 to 85C (-40 to 185F). Derate continuous current at higher ambient temperatures. Key addresses: 275D, 461E, 810F, 704F. For the full guide, download ""AMC_HWManual_FlexPro_PCB.pdf"" from a-m-c.com > Support > Downloads > Hardware Manuals."
"What are the temperature derating curves for DigiFlex panel drives?","AMC_HWManual_DigiFlex_Panel_EtherCAT.pdf","25","Products and System Requirements / System Requirements","Maximum ambient temperature and continuous current derating curves are provided per drive model. Higher ambient temperatures require reducing the continuous current limit. Key addresses: A400, B080. For the full guide, download ""AMC_HWManual_DigiFlex_Panel_EtherCAT.pdf"" from a-m-c.com > Support > Downloads > Hardware Manuals."
"How do I identify an AMC drive part number?","AMC_ProductNote_Product_Identification.pdf","1","Product Identification","AMC drive part numbers encode the family (FE/FM/FD for FlexPro, DP/DZ/DV for DigiFlex, AZ for AxCent), form factor, current rating, voltage rating, and communication protocol. Key addresses: 3012, 1165, 3805, 1935. For the full guide, download ""AMC_ProductNote_Product_Identification.pdf"" from a-m-c.com > Support > Downloads > Product Notes."
"What does the FlexPro part number encoding mean?","AMC_HWManual_FlexPro_PCB.pdf","15","Products and System Requirements / Communication Protocols","FlexPro part numbers: FE = EtherCAT, FM = Serial RS485/232, FD = CANopen, FMP = Ethernet/IP. The suffix EM = PCB mount, RM = serial variant. Numbers indicate current and voltage ratings. Key addresses: 1000, A402, 6010. For the full guide, download ""AMC_HWManual_FlexPro_PCB.pdf"" from a-m-c.com > Support > Downloads > Hardware Manuals."
"What does the DigiFlex Performance part number encoding mean?","AMC_HWManual_DigiFlex_PCB_CANopen.pdf","13","Products and System Requirements / Part Number","DigiFlex part numbers: D = DigiFlex, P/Z = form factor (Panel/PCB), E/C/R/M/P = communication (EtherCAT/CANopen/RS485/Modbus/POWERLINK). Current and voltage ratings follow. Key addresses: 1898. For the full guide, download ""AMC_HWManual_DigiFlex_PCB_CANopen.pdf"" from a-m-c.com > Support > Downloads > Hardware Manuals."
"What control modes do FlexPro drives support?","AMC_HWManual_FlexPro_PCB.pdf","17","Products and System Requirements / Control Modes","FlexPro drives support Current (Torque), Velocity, Position, Profile Position, Cyclic Synchronous Position/Velocity/Torque, and analog command modes depending on the communication variant. For the full guide, download ""AMC_HWManual_FlexPro_PCB.pdf"" from a-m-c.com > Support > Downloads > Hardware Manuals."
"What feedback types are supported on FlexPro drives?","AMC_HWManual_FlexPro_PCB.pdf","20","Products and System Requirements / Feedback Supported","FlexPro drives support differential incremental encoder, BiSS C-Mode, EnDat 2.2, Hall sensors, tachometer (+/-10VDC), and 1Vp-p Sin/Cos encoder feedback depending on the model. For the full guide, download ""AMC_HWManual_FlexPro_PCB.pdf"" from a-m-c.com > Support > Downloads > Hardware Manuals."
"What feedback types are supported on DigiFlex panel EtherCAT drives?","AMC_HWManual_DigiFlex_Panel_EtherCAT.pdf","20","Products and System Requirements / Feedback Supported","DPE drives support incremental encoder, absolute encoder (EnDat/BiSS), Hall sensors, 1Vp-p Sin/Cos encoder, auxiliary incremental encoder, tachometer, and +/-10VDC position feedback. Key addresses: 2048. For the full guide, download ""AMC_HWManual_DigiFlex_Panel_EtherCAT.pdf"" from a-m-c.com > Support > Downloads > Hardware Manuals."
"How do I configure encoder feedback on a FlexPro drive?","AMC_HWManual_FlexPro_PCB.pdf","20","Products and System Requirements / Incremental Encoder Feedback","FlexPro embedded drives can utilize differential incremental encoder inputs. Configure the encoder resolution (counts per revolution) in the motor parameters section of ACE. For the full guide, download ""AMC_HWManual_FlexPro_PCB.pdf"" from a-m-c.com > Support > Downloads > Hardware Manuals."
"How do I wire an incremental encoder to a DigiFlex panel drive?","AMC_HWManual_DigiFlex_Panel_EtherCAT.pdf","45","Operation and Features / Encoder Connections","Connect encoder A+, A-, B+, B-, Z+, Z- signals to the FEEDBACK connector. Use differential connections for noise immunity. Single-ended encoders require grounding the negative inputs. Key addresses: A800, A400, B080. For the full guide, download ""AMC_HWManual_DigiFlex_Panel_EtherCAT.pdf"" from a-m-c.com > Support > Downloads > Hardware Manuals."
"How do I configure Hall sensor feedback?","AMC_HWManual_DigiFlex_Panel_EtherCAT.pdf","15","Products and System Requirements / Feedback","Hall sensors provide commutation information for brushless motors. Connect Hall A, B, C signals and verify the Hall state sequence matches the motor's electrical angle. Key addresses: 1000, A402, 6010. For the full guide, download ""AMC_HWManual_DigiFlex_Panel_EtherCAT.pdf"" from a-m-c.com > Support > Downloads > Hardware Manuals."
"What is the commutation process for brushless motors?","AMC_HWManual_DigiFlex_Panel_EtherCAT.pdf","55","Operation and Features / Commutation","Motor commutation maintains the correct relationship between stator current and rotor position. Proper commutation requires correct Hall sensor wiring and phase angle configuration. Key addresses: A800, A400. For the full guide, download ""AMC_HWManual_DigiFlex_Panel_EtherCAT.pdf"" from a-m-c.com > Support > Downloads > Hardware Manuals."
"How do I use Step and Direction command input on a FlexPro drive?","AMC_HWManual_FlexPro_PCB.pdf","17","Products and System Requirements / Control Modes","FlexPro drives support 5V TTL Step and Direction input for position control. Connect step pulse and direction signals to the designated digital input pins. For the full guide, download ""AMC_HWManual_FlexPro_PCB.pdf"" from a-m-c.com > Support > Downloads > Hardware Manuals."
"How do I use the analog +/-10V command input?","AMC_HWManual_AnalogDrives.pdf","17","Products and System Requirements / Command Inputs","The analog command input accepts a +/-10V signal for velocity or torque control. The input impedance and full-scale scaling determine the relationship between input voltage and commanded output. For the full guide, download ""AMC_HWManual_AnalogDrives.pdf"" from a-m-c.com > Support > Downloads > Hardware Manuals."
"How do I set up a PVT motion profile over RS-485?","AMC_AppNote_006.pdf","1","AN-006 / FlexPro RS485 Serial PVT","PVT (Position-Velocity-Time) profiles are defined by specifying time intervals, velocity at each target point, and delta position. The motion engine interpolates smooth trajectories between points. Key addresses: 2024, 3012, 3805, 1935. For the full guide, download ""Application Note 006"" from a-m-c.com > Support > Downloads > Application Notes."
"How do I create a PVT table with multiple points?","AMC_AppNote_006.pdf","2","AN-006 / Table of PVT Points","Define PVT points with Time (ms), Velocity at Target (rpm), and Delta Position (revs). The drive interpolates between points to create a smooth multi-segment motion profile. Key addresses: 2024, 3012, 3805, 1935. For the full guide, download ""Application Note 006"" from a-m-c.com > Support > Downloads > Application Notes."
"How do I set up motion sequencing in DriveWare?","AMC_AppNote_035.pdf","1","AN-035 / Sequencing Overview","Sequences combine Indexes, Homing routines, and other control functions. Add step items to a Sequence using drag-and-drop, then configure step behavior including break points and looping. Key addresses: 3012, 1935, 3805, 2014. For the full guide, download ""Application Note 035"" from a-m-c.com > Support > Downloads > Application Notes."
"How do I configure the Motion Engine for start-up motion?","AMC_AppNote_027.pdf","1","AN-027 / Start-Up Motion","The Motion Engine can be configured to execute indexes or sequences automatically on power-up. Configure the start-up sequence in the Motion Engine settings. Key addresses: 3012, 2017, 3805, 1935. For the full guide, download ""Application Note 027"" from a-m-c.com > Support > Downloads > Application Notes."
"How do I tune the current loop on an analog drive?","AMC_AppNote_015.pdf","1","AN-015 / Current Loop Tuning Procedure","Start by setting the proportional gain while monitoring current response. Then tune the integral gain to eliminate steady-state error. Keep the motor voltage near the drive's high voltage rating. Key addresses: 3012, 3805, 1935. For the full guide, download ""Application Note 015"" from a-m-c.com > Support > Downloads > Application Notes."
"How do I adjust the integral gain during current loop tuning?","AMC_AppNote_015.pdf","2","AN-015 / Tune the Integral Gain","Increase the integral gain incrementally while monitoring the current response on an oscilloscope. The integral gain should eliminate steady-state error without causing oscillation or overshoot. Key addresses: 3012, 3805, 1935. For the full guide, download ""Application Note 015"" from a-m-c.com > Support > Downloads > Application Notes."
"How do I configure EtherCAT PDO assignments using DriveWare?","AMC_AppNote_017.pdf","1","AN-017 / EtherCAT PDO Assignments","Use DriveWare to modify TPDO and RPDO mappings. Consult the Object Dictionary in the communication manual for available objects that can be mapped to PDOs. Key steps: Modify and Download ; Modify the EtherCAT . Key addresses: 3012, 3805, 1935, 2013. For the full guide, download ""Application Note 017"" from a-m-c.com > Support > Downloads > Application Notes."
"How do I modify EtherCAT PDO assignments in the ESI XML file?","AMC_AppNote_017.pdf","2","AN-017 / EtherCAT PDO XML","The ESI XML file contains PDO mapping definitions. Make a backup before modifying. Update the object index, sub-index, and data length entries in the XML to customize PDO content. Key steps: Modify and Download ; Modify the EtherCAT . Key addresses: 3012, 3805, 1935, 2013. For the full guide, download ""Application Note 017"" from a-m-c.com > Support > Downloads > Application Notes."
"What network options are available for DigiFlex Performance drives?","AMC_AppNote_001.pdf","1","AN-001 / Network Options","DigiFlex drives support CANopen, RS232, RS485, EtherCAT, and POWERLINK. Each protocol has different performance characteristics in terms of throughput, latency, and cost. Key addresses: 2016, 3012, 3805, 1935. For the full guide, download ""Application Note 001"" from a-m-c.com > Support > Downloads > Application Notes."
"How do I set up RS-485 communication to a DZ drive using the MC1XDZ card?","AMC_AppNote_002.pdf","1","AN-002 / RS485 Communication to DZ","Configure the RS-485 jumper settings on the MC1XDZ interface card. Set the communication parameters including baud rate and drive address to match the host controller. Key addresses: 3012, 9600, 3805, 1935. For the full guide, download ""Application Note 002"" from a-m-c.com > Support > Downloads > Application Notes."
"How do I design an interface card for a DZ PCB mount drive?","AMC_AppNote_008.pdf","1","AN-008 / DZ Interface Card Design","The interface card design includes RS-232/485 interface, encoder connections (differential), analog inputs, digital I/O, and power connections. Follow recommended circuit designs for each section. Key addresses: 3012, FACE, 3805, 1935. For the full guide, download ""Application Note 008"" from a-m-c.com > Support > Downloads > Application Notes."
"How do I configure the DZ drive encoder interface?","AMC_AppNote_008.pdf","2","AN-008 / Encoder Interface","For single-ended encoder use, ground the non-inverted input. For differential encoders, connect A+, A-, B+, B-, Z+, Z- directly. Ensure proper cable shielding for noise immunity. Key addresses: 3012, FACE, 3805, 1935. For the full guide, download ""Application Note 008"" from a-m-c.com > Support > Downloads > Application Notes."
"How do I wire the DC power interface for a DZ drive?","AMC_AppNote_008.pdf","3","AN-008 / DC Power Interface","Connect High Voltage DC (HV+, HV-) and separate logic supply if required. Power capacity of the supply must match the drive's requirements. Use proper bypass capacitance near the drive. Key addresses: 3012, FACE, 3805, 1935. For the full guide, download ""Application Note 008"" from a-m-c.com > Support > Downloads > Application Notes."
"What are the Programmable Limit Switch (PLS) capabilities?","AMC_AppNote_034.pdf","1","AN-034 / Programmable Limit Switch Examples","PLS outputs can be configured to assert at specific position ranges (Lower Edge to Upper Edge). Use PLS for electronic cam-like applications or position-triggered output events. Key addresses: 3012, 2015, 3805, 1935. For the full guide, download ""Application Note 034"" from a-m-c.com > Support > Downloads > Application Notes."
"How do I use the Programmable Limit Switch on FlexPro drives?","AMC_SW_Manual_ACE.pdf","50","Configuring the Drive / PLS","Select Position Demand or Position Measured as the PLS source. Configure the Rollover value and set Upper/Lower Edge positions for each PLS output channel. For the full guide, download ""AMC_SW_Manual_ACE.pdf"" from a-m-c.com > Support > Downloads > Software Downloads."
"What is the velocity feedback filter and how do I configure it?","AMC_SW_Manual_ACE.pdf","65","Configuring the Drive / Velocity Feedback Filter","The feedback filter cutoff frequency sets the low-pass filter for velocity feedback. This reduces velocity ripple due to encoder quantization but adds phase lag that can affect stability. Key addresses: 1500, 2022. For the full guide, download ""AMC_SW_Manual_ACE.pdf"" from a-m-c.com > Support > Downloads > Software Downloads."
"How do I configure current limiting parameters?","AMC_SW_Manual_ACE.pdf","55","Configuring the Drive / Limits","Configure peak current limit, continuous current limit, and the foldback time constant. The drive uses time-based or charge-based current limiting algorithms to protect the motor and drive. Key addresses: A400. For the full guide, download ""AMC_SW_Manual_ACE.pdf"" from a-m-c.com > Support > Downloads > Software Downloads."
"What is the current limiting algorithm for AMC drives?","AMC_SW_Manual_DriveWare.pdf","10","Current Limiting / Understanding the Limit Envelope","The current limiting algorithm uses a peak-to-continuous foldback envelope. Peak current is allowed for short bursts, then folds back to the continuous rating based on the thermal model. For the full guide, download ""AMC_SW_Manual_DriveWare.pdf"" from a-m-c.com > Support > Downloads > Software Downloads."
"How do I use the waveform generator in DriveWare?","AMC_SW_Manual_DriveWare.pdf","15","Introduction / Getting Started","The Waveform Generator controls the axis for testing purposes. It can generate sine, square, and triangle waveforms at configurable frequency and amplitude for current, velocity, or position loops. For the full guide, download ""AMC_SW_Manual_DriveWare.pdf"" from a-m-c.com > Support > Downloads > Software Downloads."
"What are the RS-485 selection header jumper settings on DZ drives?","AMC_HWManual_DigiFlex_PCB_CANopen.pdf","60","Operation and Features / RS-485 Interface","The RS-485/232 interface is configured using header jumper pins. Set the jumpers to select between RS-485 (multi-drop) and RS-232 (point-to-point) communication modes. For the full guide, download ""AMC_HWManual_DigiFlex_PCB_CANopen.pdf"" from a-m-c.com > Support > Downloads > Hardware Manuals."
